{
  "apiVersion": "survey.mission-kit/v1alpha1",
  "kind": "SurveyRound",
  "metadata": {
    "name": "round-1"
  },
  "spec": {
    "surveyRef": {
      "apiVersion": "survey.mission-kit/v1alpha1",
      "kind": "Survey",
      "name": "survey-example",
      "semanticDigest": "sha256:4444444444444444444444444444444444444444444444444444444444444444"
    },
    "ordinal": 1,
    "role": "foundation",
    "surveyFrameRef": {
      "apiVersion": "schemas.mission-kit/v1alpha1",
      "kind": "ContextFrame",
      "name": "survey-frame",
      "semanticDigest": "sha256:1111111111111111111111111111111111111111111111111111111111111111"
    },
    "roundFrameRef": {
      "apiVersion": "schemas.mission-kit/v1alpha1",
      "kind": "ContextFrame",
      "name": "round-1-frame",
      "semanticDigest": "sha256:2222222222222222222222222222222222222222222222222222222222222222"
    },
    "parentBinding": {
      "parentFrameRef": {
        "apiVersion": "schemas.mission-kit/v1alpha1",
        "kind": "ContextFrame",
        "name": "survey-frame",
        "semanticDigest": "sha256:1111111111111111111111111111111111111111111111111111111111111111"
      },
      "scopeRelation": "partitions",
      "containmentRationale": "Round 1 partitions the Survey intent into foundation dimensions."
    }
  }
}
